name,city,state,country,employees,founded,description
Celebrity MGMT Agency,Beverly Hills,,United States,251-500 Employees,2013,"Celebrity MGMT Agency is a full-service management company that specializes in talent representation and strategic management, making it well-equipped to handle artist management. Their comprehensive range of services, including branding and public relations, helps enhance the professional relevance and growth of artists and public figures."
MOTHER ARTISTS,London,,United Kingdom,1-10 Employees,,"The company specializes in artist management and live agency services within the music industry, making it a key player for those seeking professional support in these areas."
Music Management Boston,Somerville,,United States,1-10 Employees,1981,The company provides music management services and emphasizes a focus on personalized service and current music trends.
WMA,London,,United Kingdom,51-100 Employees,2013,"WMA is a global digital creative and marketing agency that specializes in the music, entertainment, and lifestyle sectors. They focus on creating impactful partnerships between talent and brands, offering services like marketing strategy, social media, and digital advertising to enhance audience engagement."
MMF (Music Managers Forum),London,,United Kingdom,1-10 Employees,1992,"The company advocates for a transparent and fair music industry, offering a wide range of services tailored to artists, including budgeting, touring, and royalty services. They are also known for their strong presence in media and entertainment, providing essential resources like insurance for music events and legal services, which are crucial for effective artist management."
Various Artists Management,London,,United Kingdom,11-50 Employees,2005,"Various Artist Management is a dedicated management company that specializes in representing and promoting a wide array of music artists. With a presence in London and Los Angeles, the company offers comprehensive services, including talent management, marketing, and strategic planning, aimed at enhancing artists' careers through tailored solutions."
IMG Models,New York,,United States,251-500 Employees,,"The company specializes in talent management within the apparel and fashion industry, representing a diverse roster of clients, including top models. This aligns with the query about artist management, highlighting their expertise in promoting and managing careers in a competitive field."
Live Nation Entertainment,Beverly Hills,,United States,10001+ Employees,2005,Live Nation is a prominent live entertainment company that collaborates with artists to showcase their creativity on stages globally.
Paradigm Artist Management Limited,London,,United Kingdom,11-50 Employees,2008,"Paradigm Artist Management Agency is dedicated to enhancing the professional careers of artists by establishing strong relationships with key stakeholders in the entertainment industry. With a focus on new and fresh talent, they represent a diverse range of international actors, celebrities, and performers, ensuring that they meet client expectations and contribute to the industry's vibrancy."
Exclusive Artists,Los Angeles,,United States,11-50 Employees,2002,"Exclusive Artists Management is a full-service management company that represents a diverse roster of talent, including celebrity hairstylists, makeup artists, and photographers."
