name,city,state,country,employees,founded,description
BBNC,Bengaluru,,India,11-50 Employees,2020,"The company offers a wide range of services, including accounting and taxation, which encompasses bookkeeping. With a team of professionals, they leverage technology to support businesses in compliance and growth throughout their lifecycle."
Goodhams Accountants & Tax Advisors,London,,United Kingdom,11-50 Employees,2013,"Goodhams Accountants is a professional firm with extensive experience in accounting and tax compliance, making them well-equipped to handle bookkeeping needs effectively. Their commitment to providing high-quality financial solutions ensures that clients receive timely and cost-effective support for all their accounting concerns."
Eide Bailly,Fargo,,United States,1001-5000 Employees,1998,"Eide Bailly offers comprehensive bookkeeping services designed to handle day-to-day financial tasks, allowing businesses to focus on their growth and development. Their expertise in accounting and partnership with leading technology companies enhances their ability to provide effective financial management solutions."
BELAY,Roswell,,United States,1001-5000 Employees,2010,"BELAY offers specialized bookkeeping services, ensuring that clients receive top-notch financial expertise to maintain accurate and understandable data. Their remote professional bookkeepers empower organizations to efficiently manage their finances, allowing them to focus on growth and reduce stress related to financial management."
BooXkeeping Corp.,San Diego,,United States,11-50 Employees,2009,"BooXkeeping is dedicated to simplifying bookkeeping and financial data management for small to medium-sized businesses. Their customized, affordable outsourced bookkeeping services help clients stay organized and informed about their financial records, eliminating the burden of tracking expenses."
Bench Accounting,Vancouver,,Canada,501-1000 Employees,2012,"Bench is the largest bookkeeping service for small businesses in America, offering a seamless platform that combines intuitive software with professional human support. Their technology-driven approach provides live bookkeeping services, empowering entrepreneurs to efficiently manage their financial records while focusing on core business activities."
Confiance Business Solutions Inc,Ahmedabad,,India,251-500 Employees,2017,"CONFiANCE specializes in providing personalized bookkeeping and accounting services, focusing on timely and competent solutions that enhance financial management for clients. Their dedicated team ensures high-quality support, establishing strong relationships to deliver comprehensive financial solutions."
Bookkeeping Enterprises,Irvine,,United States,1-10 Employees,2008,"Bookkeeping Enterprises specializes in providing nationwide bookkeeping and accounting services, offering customizable remote solutions to ensure accurate financial statements. Their commitment to exceptional customer service and support enhances the client experience, making it easier for businesses to manage their finances effectively."
Prime Accountants Group,Coventry,,United Kingdom,51-100 Employees,1949,"The company offers bookkeeping services designed to simplify accounting functions and enhance the quality of information for business owners. Their professional and forward-thinking team is dedicated to providing clear and honest advice, leveraging new technology to benefit clients."
Bench,Vancouver,,Canada,501-1000 Employees,2012,"The company offers comprehensive bookkeeping services for small business owners, combining intuitive software with real human bookkeepers to streamline the process. This approach allows entrepreneurs to save time and focus on their core business activities."
