name,city,state,country,employees,founded,description
Brandprotect corp,-,,-,,,"Brandprotect is a technology platform that enhances branding by using advanced cryptography and blockchain to protect goods from counterfeiting. Their solution enables manufacturers to create secure certificates that ensure product authenticity and traceability, thereby building consumer trust and reinforcing brand integrity."
Bert,Manchester,,United Kingdom,11-50 Employees,,"Bert is a specialized branding agency that focuses on branding and identity, strategy, and marketing, using a unique co-creation methodology to enhance brand experiences. They work with a diverse clientele, including major brands like BBC and Manchester City FC, to create original and impactful branding strategies that drive growth and engagement."
Branding Brand,Pittsburgh,,United States,51-100 Employees,2008,"Branding Brand is a leading service provider that specializes in mobile commerce solutions, particularly for the retail, hospitality, and B2B sectors. The company focuses on creating mobile-first experiences that enhance digital engagement and satisfaction for shoppers."
Magnet Harlequin,London,,United Kingdom,51-100 Employees,1986,"BRANDED is a specialized agency in brand creation and implementation, focusing on positioning, brand architecture, and visual identity. With 40 years of experience, they offer a comprehensive range of services that ensure brand compliance and enhance visibility, making them a valuable partner for luxury brands and global retailers."
Branded,Paris,,France,101-250 Employees,2020,"BRANDED is dedicated to transforming marketplace sellers into globally recognized brands, particularly on platforms like Amazon. By partnering with successful brand founders, the company enhances brand visibility and performance through a comprehensive suite of e-commerce services, making it a key player in the branding and growth of online businesses."
Branding Constante,Lima Metropolitan Area,,Peru,1-10 Employees,2017,"The company specializes in branding, providing a variety of services such as brand strategy, packaging design, and the creation of comprehensive brand manuals."
brandsymbol,Matthews,,United States,11-50 Employees,,"Brandsymbol is a dedicated branding agency that offers a comprehensive range of services, including brand identity, strategy, and communication, tailored to meet client needs. With expertise in various markets and a focus on strategic, data-driven solutions, Brandsymbol aims to revitalize client branding efforts through innovative and creative approaches."
Interbrand,New York,,United States,1001-5000 Employees,1974,"Interbrand is a prominent brand consultancy that focuses on brand strategy, valuation, and digital management, helping brands enhance engagement and drive innovation. They emphasize the importance of making bold ""Iconic Moves"" to maintain relevance and increase brand value in a rapidly changing market."
Branders Group,Switzerland,,Switzerland,11-50 Employees,2005,"Branders is a specialized brand consultancy that excels in creating distinctive omnichannel brand interactions and offers a wide range of services including brand strategy, management, and revitalization. Their innovative approaches ensure that brand identities resonate emotionally with audiences, generating authentic value."
Happy Brands,Lisbon,,Portugal,11-50 Employees,2009,"Happy Brands specializes in branding, offering a comprehensive range of services designed to enhance brand interaction and create engaging experiences. Their expertise includes brand strategy, design, and activation, ensuring effective marketing strategies for clients."
