name,city,state,country,employees,founded,description
Cycloid,Paris,,France,,,"Cycloid offers a comprehensive DevOps platform designed to enhance developer experience through its user-friendly self-service portal. The platform simplifies cloud migration, supports hybrid cloud environments, and centralizes cost management, making it easier to efficiently manage complex cloud infrastructures."
Adastra,Toronto,,Canada,,,"Engage with a trusted AWS, Google Cloud and Microsoft partner which will help you maximize cloud ROI. Embark on your cloud journey with Adastra to confidently reshape your business for a digital future. Access a comprehensive suite of tools for swift and secure migration, optimizing costs and ensuring compliance."
Crayon Group,Oslo,,Norway,501-1000 Employees,1993,"Crayon specializes in cloud consulting and offers services that support businesses in their digital transformation, including cloud migration. Their expertise in cloud architecture and technology optimization ensures efficient cloud-first strategies."
Frontier Digital,Glasgow,,United Kingdom,1-10 Employees,2022,"The company has extensive expertise in cloud computing and automation, having successfully delivered secure and cost-effective cloud platforms globally. Their approach to technology change emphasizes agile methodologies and continuous improvement, making them well-equipped to handle cloud migration effectively."
CloudMile,San Jose,,Philippines,101-250 Employees,2017,"CloudMile specializes in cloud migration, offering professional services to help businesses transition to the cloud effectively. Their mission is to empower enterprises through modernized IT solutions and scalable digital transformations."
RiverMeadow - Workload Mobility Platform,Los Gatos,,United States,51-100 Employees,2009,"RiverMeadow specializes in multi-cloud migration services, offering a proprietary Mobility Platform that simplifies the transition of workloads to various cloud environments like AWS, Azure, and Google Cloud. Their comprehensive tools and automated processes ensure secure and efficient cloud migrations, making it easier for businesses to modernize and protect their IT systems."
Cloud4C,Singapore,,Singapore,501-1000 Employees,2014,"Cloud4C specializes in comprehensive cloud migration services, ensuring a seamless transition of your entire IT environment to a cloud platform of your choice, with a focus on innovation and enhancing customer experiences. Their expertise and structured approach to cloud adoption make them a trusted partner for enterprises looking to modernize and transform digitally."
cloudxchange.io,Mumbai,,India,101-250 Employees,2015,"At cloudxchange.io, a multi-cloud managed services provider under the NSEIT Group, they specialize in cloud migration, offering advanced consulting and tailored solutions for seamless digital transformation across major platforms like AWS, Azure, and Google Cloud. Their expert team ensures a smooth transition, helping businesses gain visibility into cloud costs and align financial data with business metrics."
Cloud Mile Inc.,Singapore,,Singapore,51-100 Employees,2017,"CloudMile is a specialized cloud and AI service provider that focuses on cloud migration, offering advanced solutions to accelerate digital transformation. Their expertise in application modernization and multi-cloud deployments, combined with their status as a Google Cloud Premier Partner, positions them as a key player in facilitating efficient and cost-effective cloud migration for businesses."
Hivemind Technologies AG,Cologne,,Germany,11-50 Employees,2014,"The company specializes in developing custom-tailored and affordable migration plans that align with your budget and business needs, ensuring secure cloud solutions. With their extensive experience and expertise, they are well-equipped to support your cloud migration projects."
