name,city,state,country,employees,founded,description
NAQEL Express,Riyadh,,Saudi Arabia,1001-5000 Employees,1993,"NAQEL Express emphasizes its commitment to becoming a leading logistics service provider in the Middle East, which includes a focus on cold chain logistics, essential for preserving perishable goods during transportation."
Lineage Logistics,Novi,,United States,10001+ Employees,2012,"Lineage Logistics is a leading provider of temperature-controlled warehousing and logistics solutions, emphasizing their expertise in cold chain logistics. They optimize the distribution of food through a global network of strategically located facilities, enhancing efficiency and sustainability in the food supply chain."
Cold Chain Consultants,Malden,,United States,11-50 Employees,,"Cold Chain Consultants specializes in providing operational support to the pharmaceutical and life-science industries, ensuring compliance with GDP and cold chain requirements for temperature-sensitive supply chains. Their focus on practical assistance addresses the growing regulatory emphasis on proper transportation of these products."
Cold Chain Technologies,United States,,United States,251-500 Employees,1967,"Cold Chain Technologies (CCT) specializes in providing innovative thermal packaging and digital solutions for the shipment of temperature-sensitive materials, primarily for the life sciences industry. With over 50 years of experience, CCT focuses on addressing the unique logistical challenges faced during the cold chain journey, ensuring high-quality and regulatory-compliant distribution solutions."
AbleCold Logistics,Bengaluru,,India,51-100 Employees,2017,"AbleCold Logistics specializes in managing cold chain logistics, ensuring robust temperature control throughout the supply chain. Their AbleCold Operating System and smart technology optimize logistics and inventory management, helping to maintain the right conditions for products during transit and storage."
Frimercat S.A.,Barcelona,,Spain,51-100 Employees,1991,"The company specializes in refrigerated logistics and cold chain management for the food industry, ensuring the maintenance of the cold chain through total traceability in storage and distribution. With over 20 years of experience, it collaborates closely with various stakeholders to manage a wide range of perishable products effectively."
Coldman Logistics Pvt Ltd,Navi Mumbai,,India,51-100 Employees,2016,"COLDMAN is a leading cold chain logistics company that specializes in providing customized storage and distribution solutions, particularly for pharmaceutical and nutraceutical products. They employ innovative technologies and a qualified team to ensure effective temperature integrity and traceability throughout the supply chain, exceeding customer expectations."
Integrated Cold Chain Logistics Sdn. Bhd.,Bukit Mertajam,,Malaysia,251-500 Employees,2006,"The company emphasizes its commitment to integrated cold chain logistics, which is crucial for maintaining product quality and compliance with standards. Their comprehensive and customized services enhance logistic workflow management, ensuring timely deliveries and efficient handling of goods."
National Cold Chain Inc.,Vaughan,,Canada,11-50 Employees,2014,"National Cold Chain is a specialized organization focused on temperature-controlled supply chain solutions, making it highly relevant for cold chain logistics. They offer tailored logistics and supply chain services for temperature-sensitive goods, ensuring effective handling and transportation."
Global Cold Chain Solutions Pte Ltd,Singapore,,Singapore,51-100 Employees,2018,"Global Cold Chain Solutions specializes in temperature-controlled logistics services for the biopharmaceutical sector, ensuring reliable and compliant courier solutions for time-critical and temperature-sensitive biological samples. Their focus on quality and competitive rates makes them a key player in cold chain logistics."
