name,city,state,country,employees,founded,description
Blizard Institute,London,,United Kingdom,1001-5000 Employees,1882,"The LSI Centre for Computational Biology specializes in computational biology, highlighting its focus on this interdisciplinary field."
MGI,Shenzhen,,China,1001-5000 Employees,2016,"MGI is a prominent provider of advanced life science tools, with a strong emphasis on DNA sequencing instruments and multi-omics platforms, making it highly relevant to the field of computational biology. Their proprietary technologies support research in areas like precision medicine and healthcare, which often rely on computational methods for data analysis and interpretation."
EBI,South Cambridgeshire,,United Kingdom,501-1000 Employees,1994,"EMBL-EBI is emerging as a pivotal entity in computational biology, leveraging machine learning to enhance its data resources, which are crucial for life science research. Their extensive tools and services support researchers in analyzing the growing volume of data."
Computomics GmbH,Tübingen,,Germany,11-50 Employees,2012,"Computomics specializes in computational biology by applying artificial intelligence to bioinformatics data, enabling rapid understanding of genomics. They offer thorough consultation and in-depth analysis of genomic data, making them a valuable partner for sequencing projects."
The Bioinformatics CRO,Orlando,,United States,11-50 Employees,2018,"The Bioinformatics CRO specializes in computational biology, offering a range of bioinformatics services that cater to the needs of biotechnology companies, particularly in genomics. Their all-remote model allows them to assemble expert teams for efficient project execution, ensuring quality and customized support for research goals."
Aganitha,Warren,,United States,11-50 Employees,2017,"Aganitha AI Inc. specializes in developing in silico solutions that enhance computational biology processes, significantly reducing experimental costs and accelerating drug discovery for both small molecules and biologics. Their integration of high-throughput sciences with deep learning models positions them as key partners for biopharma R&D, offering innovative services that streamline and optimize the development of new medicines."
Bioexplore,India,,India,11-50 Employees,2007,"Bioexplore offers specialized bioinformatics services, including online text mining from key databases like PubMed and PMC, which enhances research efficiency. Their in silico analysis solutions are designed to revolutionize data analysis processes, making them highly relevant for computational biology."
Formic Labs,South San Francisco,,United States,1-10 Employees,2022,"The company is focused on advancing computational biology by providing powerful cloud workstations and cutting-edge scientific software that enable scientists to efficiently conduct data analysis, simulation, and visualization. Their platform is designed to streamline the research process, allowing scientists to concentrate on discovery without the burdens of engineering and operations."
Luffing Future LLC,Washington,,United States,1-10 Employees,2021,"The company specializes in biotech consulting with a strong focus on bioinformatics analysis and computational biology, offering expertise in cutting-edge technologies like CRISPR-cas9."
Beckman Coulter Genomics,Newton,,United States,10001+ Employees,2008,"Beckman Coulter is a prominent player in biotechnology and healthcare, offering advanced diagnostic solutions and laboratory systems that may support computational biology through their focus on clinical testing and informatics. Their commitment to optimizing lab performance and providing a comprehensive range of diagnostics aligns with the needs of the computational biology field."
