name,city,state,country,employees,founded,description
EquipmentShare,Columbia,,United States,1001-5000 Employees,2014,"EquipmentShare specializes in equipment rental and offers a peer-to-peer marketplace for contractors to rent heavy construction equipment. Their T3 technology platform enhances fleet management and operational efficiency, providing real-time monitoring and analytics to optimize rental utilization and reduce downtime."
Sunstate Equipment Co. LLC,Phoenix,,United States,1001-5000 Employees,1977,"Sunstate Equipment specializes in providing a wide range of construction equipment and tool rentals, including heavy and earthmoving equipment, aerial equipment, and trench safety solutions. With a commitment to exceptional customer service and 24/7 support, they ensure that clients have access to the right equipment for their projects, enhancing productivity and safety."
"Sunstate Equipment Co., LLC",Phoenix,,United States,1001-5000 Employees,1977,"Sunstate Equipment is a premier provider of rental equipment specifically designed for the construction sector, offering a wide variety of heavy and aerial equipment. The company emphasizes exceptional customer service and transparency, ensuring clients have access to well-maintained equipment and support for their rental needs."
Byrne Investments,Dubai,,United Arab Emirates,501-1000 Employees,1992,"Byrne Equipment Rental is a prominent provider of equipment rental solutions in the Middle East, featuring a vast fleet of over 14,000 items, including various construction machinery such as excavators, cranes, and forklifts. Their commitment to delivering quality and customized equipment ensures that clients in the construction industry have access to the right tools for their projects."
Equipment Rentals India,India,,India,101-250 Employees,2009,"Equipment Rentals India is a prominent provider of heavy construction equipment for rent and sale across various cities in India. They offer a diverse range of machinery, including excavators, motor graders, and concrete pumps, allowing contractors to efficiently complete their projects without the high costs of purchasing equipment."
Nordeste Locações,Fortaleza,,Brazil,51-100 Employees,2011,"Nordeste Locações specializes in equipment rental for the construction and industrial sectors, offering a diverse range of essential construction equipment such as scaffolding, concrete mixers, and generators, tailored to meet the needs of the civil construction industry. With over 12 years of experience, the company is committed to providing high-quality equipment and specialized service to enhance productivity and reduce costs on construction sites."
MacAllister Rentals,Indianapolis,,United States,1001-5000 Employees,1945,"MacAllister Rentals offers a comprehensive range of construction equipment for rent, including dozers, backhoes, excavators, and aerial lifts, making it a key resource for contractors in Indiana and Michigan. With flexible rental terms and a focus on customer service, they provide ideal solutions for both short- and long-term equipment needs."
Volvo Construction Equipment,Gothenburg,,Sweden,10001+ Employees,1832,"Volvo Construction Equipment (Volvo CE) offers a wide range of construction equipment for rent, including excavators, wheel loaders, and articulated haulers, making it a key player in the construction equipment rental market. The company also provides extensive support services and financing options, enhancing the rental experience for clients in over 140 countries."
Contract Plant Rental,United Kingdom,,United Kingdom,1001-5000 Employees,2013,"Contract Plant Rental specializes in providing tailored contract plant rental solutions for the construction sector, offering both short and long-term rental opportunities of heavy machinery. Their comprehensive fleet and dedicated support aim to optimize productivity and safety on construction sites across the UK."
Equinorte Colombia,Perímetro Urbano Barranquilla,,Colombia,501-1000 Employees,1995,"The company is a leading provider of construction equipment rental, offering a wide range of high-quality and certified equipment, including formwork systems, scaffolding, and lifting machinery, tailored for residential, public works, industrial, and infrastructure projects."
