name,city,state,country,employees,founded,description
Diamond Fabrics Limited (Sapphire Group),Pakistan,,Pakistan,501-1000 Employees,1970,"Diamond Fabrics Limited is a manufacturer of high-quality denim fabrics, specializing in innovative textile production and modern trends."
KG Denim Limited,Coimbatore,,India,1001-5000 Employees,,"KG Denim is a leading manufacturer of denim fabrics, specializing in fashion denim and denim jeans. The company's commitment to innovation and quality ensures they stay competitive in the market, making them a key player in the denim industry."
Denim Crafts,Karachi Division,,Pakistan,501-1000 Employees,2010,"Denim Crafts specializes in high-quality denim products, including a variety of jeans and jackets for all ages. The company's commitment to sustainability and eco-friendly manufacturing processes enhances its production of value-added denim items."
Denim-E,Karachi Division,,Pakistan,501-1000 Employees,2018,"Denim-E is a manufacturer dedicated to providing sustainable denim solutions, specializing in eco-friendly products that aim to reduce environmental impact. Their commitment to responsible sourcing and innovative designs positions them as leaders in creating a sustainable future for the denim industry."
Sharabati Denim,Egypt,,Egypt,1001-5000 Employees,1978,"Sharabati Denim is a leading manufacturer of high-quality denim, emphasizing sustainable practices throughout its integrated production process, which includes spinning, weaving, dyeing, and finishing. With a commitment to meeting the fashion industry's demands, the company produces a significant volume of denim fabric annually, making it a key player in the textile industry."
BHASKAR DENIM,India,,India,5001-10000 Employees,,"BHASKAR DENIM is a textiles manufacturer in India that specializes in high-quality denim fabrics, serving various segments of the textile industry."
Nice Denim Mills Limited,Dhaka,,Bangladesh,10001+ Employees,,"Nice Denim Mills Ltd is a prominent manufacturer of denim fabrics in Bangladesh, offering a diverse range of products with weights from 2.5 oz to 15 oz and an annual production capacity of 72 million yards. The company emphasizes quality and sustainability, utilizing advanced technology and innovative techniques to produce high-grade denim suitable for various applications."
Denim Factory,Cali,,Colombia,251-500 Employees,1996,"Denim Factory S.A. is a specialized manufacturer with 25 years of experience in producing high-end casual clothing, including various types of denim products such as jackets and pants. The company emphasizes quality control and sustainability throughout its integrated garment creation process, ensuring innovative and environmentally friendly practices."
Denimic Limited,Dhaka,,Bangladesh,11-50 Employees,2011,"The company, Denimic Limited, specializes in denim production, offering a wide range of services for jeans manufacturing, including design, quality control, and supply chain management. With over 30 years of experience, they emphasize sustainable practices and provide access to a diverse collection of fabrics and innovative washing techniques."
US Apparel & Textiles,Lahore,,Pakistan,10001+ Employees,1975,"US Apparel & Textiles is a leading manufacturer of premium denim fabric and garments, emphasizing sustainability and innovation in the denim industry. With a diverse product line and a commitment to craftsmanship, the company caters to the global apparel and fashion market."
