name,city,state,country,employees,founded,description
99designs,Oakland,,United States,101-250 Employees,2008,"99designs by Vista is a global creative platform that connects clients with freelance designers to create custom graphic designs such as logos, web pages, and business cards. The company offers various collaboration options, including design contests and personalized projects, making it a versatile resource for anyone seeking professional graphic design services."
Abstract Image Group,Town of Islip,,United States,11-50 Employees,2001,"Abstract Image Group specializes in graphic design and large format printing, offering a range of products including signage, trade show displays, and presentation materials. With over 40 years of branding expertise and an in-house production process, the company ensures high-quality design services tailored for various industries."
Flyer Design,Evanston,,United States,1-10 Employees,,"Flyer Design is a creative services studio that specializes in graphic design and branding, offering a comprehensive range of services to meet diverse creative needs. Their expertise spans UX/UI design, digital marketing, and various forms of visual media."
Graphiker On Demand,Gold Coast City,,Australia,11-50 Employees,,"Graphiker is a subscription-based graphic design service that connects businesses with skilled designers to create a variety of visual content, ensuring a cohesive brand identity. With features like unlimited design requests, fast turnaround times, and a 14-day money-back guarantee, it provides an accessible and cost-effective solution for businesses looking to enhance their graphic design needs."
Sano Design Services,New York,,United States,1-10 Employees,2002,"Sano Design Services specializes in graphic design, offering original graphic design services, product illustrations, and raster to vector conversion. With a vast library of over 25 million textile designs and advanced software technologies, they ensure quick and professional services for the apparel and fashion industry."
Creative Graphic Services,Santa Clarita,,United States,11-50 Employees,,"Creative Graphic Services (CGS) specializes in graphic design through its extensive large format printing capabilities. With over 40 years of experience, CGS offers a diverse range of products, such as signage, vehicle wraps, and banners, utilizing advanced printing technologies to meet various client needs."
Graphic Designer,Brussels,,Belgium,1-10 Employees,2018,"The company specializes in graphic design, offering a diverse range of services that include print and web graphics, visual identity development, and multimedia content integration. Thomas Lammens, a graphic designer, showcases his portfolio that highlights his expertise in creating visually engaging designs across various mediums, from print to digital."
Design Cloud,Manchester,,United Kingdom,11-50 Employees,2020,"Design Cloud specializes in professional graphic design, offering a range of services including presentation design, logo design, and social media design, making it an ideal partner for businesses seeking to enhance their visual content and marketing communications. Their efficient and affordable solutions streamline access to high-quality graphic design, catering to various industries."
The Graphic Design House,Portsmouth,,United Kingdom,11-50 Employees,,"The Graphic Design House is a prominent graphic design agency that offers a comprehensive range of design services, including brand identity and marketing campaigns, tailored for both online and offline platforms. With over 18 years of experience, the company focuses on delivering customized design solutions that meet client needs effectively and creatively."
Design 446,Manasquan,,United States,11-50 Employees,1974,"Design 446 is a marketing and advertising agency that specializes in graphic design, offering services that range from basic illustrations to complex collateral. Their talented team of designers focuses on delivering innovative and dynamic solutions to help brands stand out in a crowded market."
