name,city,state,country,employees,founded,description
Right Seat,Rwanda,,Rwanda,51-100 Employees,2015,"Right Seat is a specialized HR service provider in Kigali, Rwanda, offering comprehensive HR outsourcing solutions that enable businesses to streamline their HR processes. Their expertise in payroll, employee management, and compliance ensures that organizations can focus on growth while effectively managing their workforce and aligning talent strategies with business goals."
HR Options Inc.,Concord,,United States,1001-5000 Employees,1989,"HR Options is a dedicated HR service provider that offers comprehensive HR outsourcing solutions, including management, consulting, and recruitment. With over 35 years of experience, the company focuses on personalized services and compliance, making it an effective partner for businesses looking to enhance or completely outsource their HR functions."
24HRPO,Makati,,Philippines,251-500 Employees,2008,"24HRPO is a prominent provider of offshore human resource services, with a strong focus on recruitment process outsourcing (RPO) and HR administration. The company enhances organizational recruitment capacity and efficiently manages various HR functions, making it a valuable partner for HR outsourcing needs."
Volt Management Services Limited,Nairobi,,Kenya,5001-10000 Employees,2016,"The company specializes in human resource management solutions, offering comprehensive HR Business Process Outsourcing, including recruitment services and payroll management. Their commitment to timely project delivery and employee development makes them a valuable partner for businesses seeking effective HR outsourcing solutions."
HR Services,Lahore,,Pakistan,11-50 Employees,,"HR Services is a consultancy and outsourcing company that specializes in comprehensive HR solutions, including complete HR outsourcing, tailored for various organizational sizes in Pakistan. Their services encompass Recruitment Process Outsourcing (RPO), payroll outsourcing, and employee engagement, making them a valuable resource for businesses seeking to streamline their HR functions."
H1 HR Solutions Pvt. Ltd.,Mumbai,,India,1001-5000 Employees,2018,"H1 specializes in HR outsourcing, offering a range of services including recruitment, staffing, payroll management, and legal compliance, all tailored for brands in the Asian markets. With over 30 years of experience, H1 ensures businesses can effectively navigate HR challenges and stay competitive through its comprehensive and technology-driven solutions."
Trenkwalder Group,Schwechat,,Austria,10001+ Employees,1985,"Trenkwalder Group is a prominent HR service provider in Central and Eastern Europe, offering a wide array of HR solutions, including Business Process Outsourcing, which encompasses critical support in payroll services and talent management. Their expertise in navigating complex labor regulations and providing operational support helps companies effectively manage their HR needs."
HR INDIA SOLUTIONS,Faridabad,,India,11-50 Employees,2009,"HR India Solutions is a specialized Human Resources Outsourcing (HRO) firm that provides comprehensive HR solutions, including payroll management, compliance support, and tailored training programs. Their expertise in HR outsourcing aims to enhance clients' recruitment processes and overall workforce efficiency, making them a key player in the HR consulting landscape."
HR Source,Downers Grove,,United States,11-50 Employees,1898,"HR Source specializes in providing outsourced HR services to support employers with various human resource functions. Their experienced HR professionals can handle tasks such as recruiting, performance management, employee engagement, and day-to-day HR operations, allowing organizations to effectively meet their growing HR needs."
HR World International (Pvt. Ltd) - Global Tech Recruitment Payroll HRIS and Executive Headhunters,Pakistan,,Pakistan,51-100 Employees,2015,"HR World International specializes in HR outsourcing, offering a range of services including Recruitment Process Outsourcing, Payroll Management, and Performance Management Solutions. Their tailored HR services are designed to enhance employee engagement and align with the unique needs of businesses, making them a comprehensive partner for HR needs."
