name,city,state,country,employees,founded,description
Influencer,London,,United Kingdom,51-100 Employees,2015,"Influencer is a global leader in influencer marketing, offering a sophisticated platform and strategic insights that transform data into effective marketing strategies. Their innovative approach and strong relationships with top brands and social media platforms enable them to create impactful connections between brands and creators."
HypeFactory | Influencer Marketing Agency,Nicosia,,Cyprus,51-100 Employees,2016,"HypeFactory is a global influencer marketing agency that specializes in creating tailored campaigns across platforms like Instagram, YouTube, TikTok, and Twitch. Their services include influencer identification and campaign management, utilizing advanced analytics to maximize ROI for clients."
IG Media House,New Delhi,,India,251-500 Employees,,"The company specializes in influencer marketing, connecting brands with numerous influencers to enhance product promotion and brand visibility. They emphasize their expertise in providing tailored influencer marketing services that align with a brand's aesthetic, ensuring effective audience engagement."
ClanConnect,New Delhi,,India,11-50 Employees,,"The company is a prominent AI-driven influencer marketing platform that connects brands with influencers, enhancing marketing strategies through influencer trend analysis and campaign management."
The Influencer Marketing Factory - Influencer Marketing Agency,Miami Beach,,United States,11-50 Employees,2018,"The Influencer Marketing Factory offers comprehensive influencer marketing services across various major cities, emphasizing tailored campaigns that align with clients' goals and visions. They prioritize tracking and reporting, providing extensive analytics to measure the success of campaigns on platforms like TikTok, Instagram, and YouTube."
Influencer.in,Chennai,,India,11-50 Employees,2015,"The company emphasizes its expertise in influencer marketing, highlighting that it collaborates with over 500 gaming streamers to achieve significant reach, driving millions of views and installs for various brands. By combining performance marketing with influencer strategies, the company aims to enhance ROI, addressing the common challenge of ineffective spend in the industry."
Influence Network,London,,United Kingdom,11-50 Employees,2016,"Influence Network leverages AI algorithms and a custom campaign management platform to enhance influencer marketing efforts for agencies and brands. Their comprehensive system facilitates the discovery of top-performing influencers, campaign scaling, and seamless payment processes, making it easier to manage and measure the success of influencer campaigns across various social platforms and locations."
Influency.me,São Paulo,,Brazil,51-100 Employees,2018,"The company specializes in influencer marketing, offering nearly 10 years of experience and a comprehensive solution that connects brands with influencers. They provide proprietary campaign management software and operate on a full-service model, ensuring effective and measurable influencer marketing strategies for their clients."
The Outloud Group,Detroit,,United States,51-100 Employees,2008,"The Outloud Group is a highly trusted influencer marketing agency that specializes in creating and executing strategic campaigns designed to deliver measurable results for high-growth consumer brands. Their dedicated team focuses on connecting influencer campaigns to business outcomes, ensuring a strong return on investment through a structured process from goal setting to campaign analysis."
Post2B | The Influencer House,São Paulo,,Brazil,51-100 Employees,2017,"The company specializes in influencer marketing, effectively connecting brands with ideal influencers through a user-friendly platform. They focus on maximizing campaign effectiveness by identifying and collaborating with digital creators to enhance branded content."
