name,city,state,country,employees,founded,description
?What If!,London,,United Kingdom,251-500 Employees,1992,The company emphasizes that innovation is an active process focused on asking transformative questions that drive growth. They highlight their commitment to building futures and leading cultures that foster continuous innovation.
Kearney,Chicago,,United States,1001-5000 Employees,1926,"The company, Kearney, specializes in management consulting and offers a range of services that can support innovation in business operations and performance. Their expertise in transforming ideas into actionable outcomes is crucial for organizations looking to enhance their innovative strategies."
Premier Consulting,Dubai,,United Arab Emirates,11-50 Employees,,"The company is a dynamic niche consulting firm dedicated to helping small and medium businesses achieve sustainable growth through innovative strategies that transform processes and approaches. Their commitment to professionalism and curiosity drives them to provide a comprehensive suite of consulting services, including corporate finance expertise."
Think Horizon Consulting LLP,Chennai,,India,1-10 Employees,2018,"The company, Think Horizon Consulting, is a management consulting provider that specializes in innovation consulting. They assist organizations in discovering, developing, and delivering innovative solutions through strategic management practices."
INNOCONSULT,Dubai,,United Arab Emirates,51-100 Employees,,"The company specializes in innovation consulting, offering a variety of services that enhance innovation capabilities and align business strategies. Key offerings include Innovation Sprint, Open Innovation, and Disruptive Innovation programs, as well as assessments of organizational culture and capabilities for innovation."
Lead Innovation,Vienna,,Austria,11-50 Employees,2003,"The company specializes in management consulting with a strong emphasis on holistic innovation management, providing long-term support for various types of innovations. They assist organizations in developing innovative structures and processes to foster a culture of innovation excellence."
innosabi GmbH,Munich,,Germany,51-100 Employees,2010,"Innosabi specializes in innovation consulting, offering tailored solutions that extract insights from emerging trends and uncover competitors' strategies. They leverage artificial intelligence and machine learning to enhance R&D development and maximize innovation potential."
Innovior,Melbourne,,Australia,51-100 Employees,2016,"Innovior specializes in innovation consulting by optimizing business processes through advanced technologies like automation and AI analytics. Their integrated approach combines strategy and execution, ensuring measurable outcomes for clients."
ideas4all Innovation,Madrid,,Spain,11-50 Employees,2008,"The company specializes in innovation consulting, offering services that help organizations manage and implement innovative projects. They provide personalized support, strategic planning, and proprietary software to foster open innovation and empower organizations to thrive in a rapidly changing environment."
ACE Cortex,São Paulo,,Brazil,51-100 Employees,2012,"The company specializes in innovation consulting and digital transformation, providing training and methodologies that empower entrepreneurs and intrapreneurs to develop new, innovative businesses. They support clients throughout the business discovery process, utilizing agile methodologies to enhance collaboration and improve organizational agility, ultimately aiming to drive exponential innovation within companies."
