name,city,state,country,employees,founded,description
FactorONE Invoice Finance,Greater Brisbane,,Australia,51-100 Employees,2011,"FactorONE offers a flexible invoice financing solution that ensures quick approvals, often within 24 hours, allowing businesses to meet payment deadlines without risking personal assets."
Stenn,London,,United Kingdom,101-250 Employees,2015,"Stenn offers invoice financing, allowing sellers to convert their invoices into cash quickly, thereby boosting their turnover and providing immediate capital for business expansion. This service is designed to facilitate growth for businesses engaged in international trade, e-commerce, and digital services."
Accelerated Payments,Dublin,,Ireland,11-50 Employees,2017,"The company offers an efficient Invoice Financing service that provides immediate cash flow by accelerating the payment of invoices, allowing businesses to manage operational costs and growth without incurring additional debt. Their user-friendly platform streamlines the application and approval process, making it easy for businesses to access the funds they need quickly."
Cashinvoice,Mumbai,,India,51-100 Employees,2018,"Cashinvoice is a service provider that specializes in financial services, particularly in enhancing supply chain finance for small and medium enterprises (MSMEs) through its digital marketplace. The platform connects financial institutions and large corporations with MSME partners, offering access to working capital by unlocking capital trapped in invoices, thereby improving liquidity."
InvoiceInterchange Australia,Melbourne,,Australia,1-10 Employees,2015,"InvoiceInterchange offers an online invoice financing platform that allows businesses, especially SMEs, to quickly access funds from outstanding invoices. This service helps alleviate cash flow issues caused by delayed payments, providing a flexible solution to support growth and manage financial fluctuations."
Bill.com,Palo Alto,,United States,501-1000 Employees,2006,"BILL offers Invoice Financing that allows businesses to finance outstanding customer invoices and receive payments in as little as 5-10 minutes, significantly reducing the typical 30-day waiting period. This service streamlines the accounts payable process, enhancing cash flow and enabling faster access to funds."
Invoice Financing Australia,Melbourne,,Australia,1-10 Employees,2015,"The company specializes in tailored invoice financing solutions, offering fast and affordable access to cash flow from debtors. Their services enable businesses to reclaim funds quickly, with the potential for immediate payment of invoices, allowing for growth and inventory purchases without delays."
Mintifi,Mumbai,,India,251-500 Employees,2017,"Mintifi offers innovative lending solutions that enhance supply chain financing, which may be relevant for businesses exploring invoice financing options."
Wise Factoring,Cardiff,,United Kingdom,1-10 Employees,2018,"The company highlights that invoice financing, including invoice factoring and discounting, is an effective financial solution for newly established or growing businesses seeking to improve cash flow management. This is particularly relevant for businesses that offer extended payment terms to their clients."
Sonovate,London,,United Kingdom,101-250 Employees,2014,"Sonovate is a leading provider of invoice financing, offering fast and flexible funding solutions that enhance cash flow by allowing businesses to release funds against outstanding invoices. With over £4 billion in invoices funded and a robust tech-driven platform, Sonovate supports businesses of all sizes, from startups to enterprises, in scaling their operations effectively."
