name,city,state,country,employees,founded,description
Economist Intelligence: EIU,London,,United Kingdom,251-500 Employees,,"The company specializes in providing market intelligence through comprehensive country and industry analysis, strategic operations, and custom research. Their services, which include forecasting and market sizing, equip organizations with high-quality data and insights essential for understanding political and economic developments that impact businesses and markets globally."
Euromonitor International,London,,United Kingdom,1001-5000 Employees,1972,"Euromonitor International specializes in market intelligence, offering a comprehensive syndicated market research database that provides detailed data and analysis on industries and consumers across 1,200 cities and 210 countries. Their approach combines data science and on-the-ground research to help clients understand market dynamics and identify opportunities for successful product launches."
Market Intelligence Data,Harrisburg,,United States,51-100 Employees,2016,"Market Intelligence Data, part of the Ameliorate Solutions Group, specializes in providing comprehensive market research reports that aid in decision-making for various industries and organizations. Their offerings include global and regional market intelligence, statistical forecasts, competitive analysis, and strategic recommendations, all designed to support clients in achieving their goals."
NielsenIQ,Chicago,,United States,10001+ Employees,1923,"NIQ provides comprehensive insights into consumer buying behavior, essential for understanding market dynamics and identifying growth opportunities. With a century of experience, they emphasize the importance of turning complex data into actionable insights, particularly for enhancing ecommerce performance."
Mintel,London,,United Kingdom,1001-5000 Employees,1972,"Mintel offers game-changing market intelligence solutions that provide instant answers to strategic questions, helping businesses track and analyze global product innovation. Their reliable insights into new products and market trends equip industry leaders with the knowledge to stay ahead."
GfK,Nuremberg,,Germany,10001+ Employees,1934,"GfK offers extensive market intelligence through its advanced analytics and comprehensive consumer insights, empowering brands with trusted data to drive growth. Their expertise in market and retail dynamics, enhanced by the recent merger with NIQ, positions them as a key resource for businesses seeking in-depth market knowledge and innovative strategies."
Dominio Consultores,Lima Metropolitan Area,,Peru,1-10 Employees,1998,"The company is a leading Peruvian consultancy specializing in Market Intelligence, offering tactical insights that allow for market and product stock estimation, distinguishing itself from competitors' forensic reports."
Intelligence Node,Mumbai,,India,101-250 Employees,2012,"The company, Intelligence Node, offers PriceIntelligence AI, a solution trusted by leading retailers worldwide for market intelligence."
Intelligentsia Worldwide,London,,United Kingdom,11-50 Employees,1990,"Intelligentsia Worldwide, a leader in Global Market Intelligence Consultancy, specializes in providing comprehensive market intelligence services, including competitor and customer insights. With over 30 years of expertise, the company delivers bespoke intelligence solutions that enhance strategic decision-making."
GlobalData,London,,United Kingdom,1001-5000 Employees,2007,"The company provides a comprehensive platform that integrates unique data and expert analysis, offering valuable market and competitive intelligence. Their services support various sectors, including strategic planning, innovation, and market strategy."
