name,city,state,country,employees,founded,description
OnBoarding Mexico,Mexico,,Mexico,11-50 Employees,2011,"The company specializes in talent management and recruiting, offering services that could enhance the onboarding process for organizations of all sizes. With over 15 years of experience, they provide professional evaluations and support that are essential for effective talent development."
Personio,Munich,,Germany,501-1000 Employees,2015,"Personio provides comprehensive Employee Onboarding Software designed to seamlessly onboard new employees and enhance productivity from day one. With features like automated processes, onboarding checklists, and templates, it streamlines the onboarding experience and helps improve employee retention."
ServiceTitan,Glendale,,United States,1001-5000 Employees,2012,"The company offers a platform designed to enhance productivity through data-driven software and automation, which can streamline onboarding processes. Their focus on creating elevated user experiences and improving workflows is particularly relevant for effective onboarding."
Paycom,United States,,United States,1001-5000 Employees,1998,"Paycom offers a robust onboarding software solution designed to streamline the transition of new hires into productive team members, enhancing the overall employee experience. Their comprehensive Human Capital Management system ensures that businesses can manage the entire employee life cycle effectively, from recruitment to onboarding, without the need for data re-entry."
Hibob,Tel-Aviv,,Israel,251-500 Employees,2015,"HiBob's HR platform, Bob, offers a streamlined and efficient onboarding process that enhances the new hire experience from day one. With features designed to showcase company culture and improve employee engagement, Bob ensures that onboarding is not only effective but also personal and impactful."
Webonboarding,West Oxfordshire,,United Kingdom,51-100 Employees,2000,"Webonboarding offers a digital onboarding solution that streamlines the employee onboarding process through a personal smartphone dashboard, allowing new hires to complete their paperwork quickly and efficiently. With its focus on reducing paperwork and tracking progress, Webonboarding enhances the overall onboarding experience from the moment a role is offered."
HR Cloud,El Segundo,,United States,51-100 Employees,2017,"HR Cloud offers a comprehensive onboarding software solution designed to streamline the onboarding process, reduce hiring costs, and enhance employee retention. With features like automated onboarding workflows and access to essential paperwork, it caters to organizations of all sizes, ensuring a smooth and efficient experience for new hires."
Darwinbox,Kallur,,India,251-500 Employees,2015,"Darwinbox offers an Employee Onboarding Software that creates a digitally seamless onboarding experience, setting new hires up for success and significantly shortening their time to productivity. This end-to-end HRMS suite not only enhances candidate experiences before Day 1 but also maximizes workforce productivity through real-time data and advanced analytics."
NEOGOV,El Segundo,,United States,251-500 Employees,1999,"NEOGOV offers a comprehensive employee onboarding software that streamlines new hire processes, ensuring preparedness and productivity from day one. Their platform automates paperwork and training, catering specifically to the needs of public sector HR teams."
Pulse Software,Sydney,,Australia,51-100 Employees,2011,"Pulse Software offers a comprehensive onboarding module as part of its business process management software, designed to streamline and enhance the onboarding experience for new employees. Their user-friendly, cloud-based solution not only manages recruitment and training but also aligns organizational actions with strategic plans, ultimately reducing anxiety for new hires and improving accountability."
