name,city,state,country,employees,founded,description
Saputo Foodservice,Lincolnshire,,United States,10001+ Employees,1954,"Saputo is a prominent manufacturer and distributor of a diverse range of high-quality cheeses, including various pressed cheeses that inspire menu creativity. Their product lineup features flavor-infused Cheddar and Jack cheeses, highlighting unique aging processes and innovative flavor combinations, catering to the evolving tastes of consumers."
Schreiber Foods,Green Bay,,United States,5001-10000 Employees,1945,"Schreiber Foods specializes in processed cheese, along with other dairy products like cream cheese and yogurt. The company emphasizes food safety and product quality, serving a global market."
Leprino Foods,Denver,,United States,1001-5000 Employees,1956,"Leprino Foods Company specializes in dairy products, particularly mozzarella cheese, and offers Leprino Precision Melt Cheese, which features controlled melt technology specifically designed for enrobed and high-heat applications. This innovative cheese maintains its integrity and provides optimal fill, addressing common issues with traditional cheeses."
Dairy Craft India Pvt Ltd,New Delhi,,India,51-100 Employees,1993,"Dairy Craft specializes in a variety of processed cheese products, including convenient options like grated, sliced, and block cheese, designed for easy use in pizzas, sandwiches, and snacks. Their offerings include a blend of mozzarella and cheddar with excellent melting properties, as well as flavored and smoked varieties, all made from high-quality milk."
Great Lakes Cheese Co,Hiram,,United States,1001-5000 Employees,1958,"Great Lakes Cheese is a prominent manufacturer of processed cheeses, emphasizing their commitment to high quality and safety throughout the production process. They ensure that all cheese products are sourced responsibly and comply with stringent food safety standards."
Bridge Cheese,Telford,,United Kingdom,51-100 Employees,2018,"Bridge Cheese specializes in producing a variety of high-quality functional cheese products, including fat-filled and heat-stable options, which cater to specific needs and price points. Their commitment to customer collaboration and innovative production techniques allows them to create bespoke cheese blends that ensure both functionality and budget requirements are met."
Cheesepop food group,Utrecht,,Netherlands,11-50 Employees,2009,"The company specializes in innovative cheese products, including processed cheese, which is real cheese enhanced with melting salts to improve texture, control melting points, and extend shelf life. Their offerings highlight cost-saving opportunities for the food manufacturing industry while ensuring high quality and sustainability."
Traditional Cheese Company,Dublin,,Ireland,51-100 Employees,1985,"The Traditional Cheese Company specializes in a variety of specialty cheeses, bringing over 30 years of experience in providing high-quality dairy products to the Irish market."
FLORALP,Ecuador,,Ecuador,251-500 Employees,1964,"The company specializes in creating a diverse range of cheese products, including processed cheese varieties like Swiss Toast Cheese, Cheddar Burger Cheese, Emmentaler Cheese, and Jalapeño Cheese, all of which are ideal for cold or hot sandwiches. Their commitment to quality and flavor positions them as experts in the dairy industry."
Saputo Inc.,Montreal,,Canada,10001+ Employees,1954,"Saputo is a prominent manufacturer of high-quality cheese and dairy products, processing approximately 11 billion liters of milk annually into a diverse range of cheeses. As one of the top cheese producers in the USA and the largest branded cheese manufacturer in the UK, Saputo's extensive product portfolio includes various cheese types, which are marketed under both their own brands and private labels."
