name,city,state,country,employees,founded,description
Hero Insurance Broking,New Delhi,,India,51-100 Employees,2004,"Hero Insurance Broking is a leading insurance broker in India, offering a range of general insurance products, including property insurance, through a web-based portal that enhances the distributor's ability to serve customers effectively. Their strong reputation and commitment to regulatory standards ensure that clients receive outstanding service and diverse product choices."
Bryte Insurance Company Limited,Johannesburg,,South Africa,501-1000 Employees,1965,"Bryte Insurance Company Limited specializes in property insurance, offering an extensive range of commercial coverage tailored for large and medium enterprises, as well as specialized risks. Their commitment to customer service and established insurance heritage positions them as a proactive risk specialist in Southern Africa."
Verisk,Jersey City,,United States,1001-5000 Employees,1971,"Verisk focuses on delivering value through advanced analytics and modeling, which can enhance the property insurance sector by providing insights that improve decision-making and risk assessment. Their commitment to innovation and quality service supports the needs of homeowners insurance."
Aon,London,,United Kingdom,10001+ Employees,1982,"The company specializes in insurance and risk management, offering a comprehensive range of solutions that include property insurance. Their focus on innovation and advanced technologies enhances decision-making and resilience for clients in various sectors."
Insurance Authority,Hong Kong Island,,China,251-500 Employees,,"The Insurance Authority (IA) is a key regulatory body in Hong Kong's insurance sector, overseeing and supervising insurance entities to ensure market stability and protect policyholders."
Information Providers Inc.,Hopkins,,United States,501-1000 Employees,1996,"The company emphasizes its expertise in risk and loss control information, which is crucial for property insurance. Their advanced technology and dedicated team ensure accurate and reliable data, supporting both large and small projects."
RSA Insurance Group,London,,United Kingdom,10001+ Employees,1710,"RSA is a multinational insurer that offers a range of commercial insurance products tailored for various sectors, making it relevant for those seeking property insurance solutions. The company's commitment to understanding customer needs ensures they provide both standard and bespoke insurance options."
CNA Insurance Company,Chicago,,United States,5001-10000 Employees,1897,"CNA is a prominent provider of property insurance, offering tailored solutions that include property damage coverage for both commercial and residential properties. With over 120 years of experience, CNA ensures effective risk management and business resilience through specialized insurance products and resources."
Intact Insurance Specialty Solutions,Plymouth,,United States,1001-5000 Employees,,"Intact Insurance Specialty Solutions offers a diverse range of specialty insurance products, including excess property insurance, designed to meet the unique needs of various industries. Their focus on tailored coverages and exceptional customer service ensures that they can effectively protect what makes each business special."
Travelers Syndicate Management,London,,United Kingdom,10001+ Employees,1971,"Travelers offers comprehensive property insurance that protects large corporates against damage to buildings and contents. With over 160 years of experience, they provide specialized guidance and superior risk management services tailored to the specific needs of businesses."
