name,city,state,country,employees,founded,description
PRWeek UK,London,,United Kingdom,11-50 Employees,1984,"PRWeek is a prominent publication dedicated to the public relations industry, offering in-depth news, insights, and analysis. It also organizes key events for PR professionals, making it an essential resource for those in the field."
North Strategic,Canada,,Canada,51-100 Employees,2011,"The company is a PR agency that offers a strong network of talent, including strategists and former journalists, to provide authentic and cohesive storytelling. Their public relations services are designed to build impactful brands."
Edelman Digital,New York,,United States,10001+ Employees,1952,"Edelman is a global communications firm that specializes in public relations, along with brand marketing, digital communications, and crisis communications. The company offers a comprehensive range of services, including corporate relations and strategic communications, aimed at helping businesses and organizations enhance and protect their brands and reputations."
Backstage Communication,Brussels,,Belgium,11-50 Employees,2007,"The company specializes in public relations and communications for clients in the Benelux market, offering tailored services such as media relations, crisis communication, and branding. Their expert team develops custom PR strategies that enhance brand visibility and effectively engage with media to promote clients' messages."
Weber Shandwick,New York,,United States,1001-5000 Employees,1921,"Weber Shandwick is a leading global communications agency that specializes in public relations and strategic communication. The agency emphasizes the importance of brands actively contributing to culture, highlighting its expertise in navigating the intersection of society, media, policy, and technology."
P.R. & Go Up Communication Partners s.r.l.,Milan,,Italy,11-50 Employees,,"The company listens to the needs of businesses and transforms them into strategic ideas, creating tailored projects and campaigns that emphasize integrated and valuable communication. Their PR services are designed to support clients throughout the entire communication process or through targeted actions, with a focus on fostering growth."
PRCO Group,London,,United Kingdom,51-100 Employees,1987,"PRCO Group is a global marketing and communications agency that specializes in public relations among other services. With extensive industry knowledge and a focus on integrated communications, the company effectively manages media relations and develops tailored strategies for its clients."
Next PR,Colorado Springs,,United States,51-100 Employees,1978,"Next PR is an award-winning public relations firm that specializes in comprehensive and integrated PR strategies designed to enhance client visibility and engagement. Their extensive services include media relations, social media management, crisis communication, and more, all tailored to achieve specific client goals."
Richmond Public Relations,Seattle,,United States,11-50 Employees,1992,"Richmond Public Relations specializes in public relations and communications, offering a comprehensive range of services such as media relations, crisis communication, and reputation management. They focus on building strategic partnerships to enhance visibility and reputation for both high-profile companies and start-ups."
Public Relations Society of America (PRSA),New York,,United States,11-50 Employees,1947,"The Public Relations Society of America (PRSA) is a key professional association that supports the advancement of public relations through resources for professional development, networking, and ethical guidance. With a strong focus on advocacy, diversity, and inclusion, PRSA serves a large membership base, providing opportunities for skill enhancement and career growth."
