name,city,state,country,employees,founded,description
Sociall.in,Chennai,,India,11-50 Employees,2013,"Sociall.in is a prominent social media management company that offers social media marketing services to businesses, highlighting its expertise and growth in the industry. With a portfolio of over 100 accounts, the company has established a strong presence in the market."
Varemar Digital Marketing,Teaneck Township,,United States,11-50 Employees,2016,"Varemar is dedicated to delivering effective social media marketing solutions through personalized strategies that align with each brand's unique identity and objectives. Their commitment to measurable results and client satisfaction ensures that they stay updated on the latest digital trends, providing regular reports and transparent pricing."
Social Media Lab,Stockholm,,Sweden,11-50 Employees,2010,"The company highlights its expertise in social media marketing, emphasizing its leadership as a top Facebook and Google agency in Sweden. With a strong focus on innovation, they integrate social media into their core marketing strategy."
S2S Marketing,Islamabad,,Pakistan,251-500 Employees,2019,"S2S Marketing is a leading digital marketing company in Islamabad, offering comprehensive social media marketing services as part of their 360 digital marketing approach. Their expertise in both traditional and modern marketing techniques ensures exceptional results for clients in Pakistan and globally."
Virtual Social Media,Chennai,,India,10001+ Employees,,"Virtual Social Media is a service provider that specializes in social media marketing, offering a range of services including social media optimization and online reputation management. They tailor their service packages to meet unique client needs, ensuring effective online visibility and business growth."
Socialforming,New Delhi,,India,251-500 Employees,,"The company specializes in social media services, helping clients to develop and enhance their online presence and reputation across various platforms."
Brandingnuts,Hyderabad,,India,11-50 Employees,2019,"Brandingnuts is a leading digital marketing company in Hyderabad, specializing in social media marketing and management. They have successfully created and implemented marketing strategies for clients, including promoting new products and designing engaging webpages."
Metro Social Media,Indianapolis,,United States,51-100 Employees,,"Metro Social Media is a cloud marketing technology company that provides comprehensive solutions for social media marketing, including data-driven insights and Facebook Ads management. Their specialized platform features tools for measuring social ROI and optimizing real-time news feeds, making it easier for brands to maintain an active and engaging social media presence."
Social Media Delivered,Carrollton,,United States,11-50 Employees,2008,"Social Media Delivered is a digital marketing service provider that specializes in social media marketing, offering services such as strategy development, coaching, community management, and campaign execution. They leverage multiple platforms, including Twitter, LinkedIn, and Facebook, to enhance their clients' social media presence and engagement."
FTI Management,Detroit,,United States,1-10 Employees,2019,The company provides top-tier social media marketing services as part of its comprehensive digital marketing offerings for small and medium-sized businesses (SMBs).
