name,city,state,country,employees,founded,description
Lincoln Electric,Cleveland,,United States,10001+ Employees,1895,"The company specializes in manufacturing advanced welding products and automated solutions, which likely includes innovations in spot welding. Their extensive offerings and commitment to comprehensive welding processes suggest they are well-equipped to meet diverse welding needs across various industries."
"Spot Welders, Inc.",Los Angeles,,United States,11-50 Employees,1993,"Spot Welders is a creative editorial company that provides specialized editing services for various media, including commercial projects and feature films. Their expertise in storytelling and commitment to high-quality execution may be relevant for projects that involve spot welding in visual storytelling contexts."
ARM WELDERS PRIVATE LIMITED,India,,India,51-100 Employees,1977,"The company, ARM Welders Pvt Ltd, specializes in high-quality spot welding equipment, offering a range of products including integrated transformer spot welding guns and robotic servo spot welding machines. Their focus on superior technology and automation solutions aims to enhance productivity and efficiency in welding processes, ultimately increasing throughput time for their customers."
Telwin SpA,Villaverla,,Italy,251-500 Employees,1963,"Telwin offers a diverse range of spot welding machines, highlighting its commitment to innovative and technologically advanced solutions for various production fields, including automotive and industry."
ARO Welding Technologies,Montval-sur-Loir,,France,101-250 Employees,1949,"ARO Welding Technologies SAS has extensive experience in resistance welding technology, offering a range of solutions including spot welding, which is essential for the automotive and manufacturing industries."
Electroweld Industries,Mumbai,,India,51-100 Employees,1974,"Electroweld Industries is a prominent manufacturer of welding machines, offering a diverse range of products in the Resistance Welding category, including spot welders. Their extensive portfolio features over 50 welding machines, showcasing their expertise and commitment to high quality and customer satisfaction."
HYBROCO SALES INC.,Stockbridge,,United States,11-50 Employees,1986,The company has over 30 years of experience in providing stud welding equipment and has grown to serve various industries. Their dedication to service and extensive inventory suggests they are well-equipped to meet diverse welding and fastening needs.
QA Weld Tech Ltd,Guisborough,,United Kingdom,51-100 Employees,1980,"QA Weld Tech is a prominent provider of integrated welding and engineering services, emphasizing their expertise in various welding technologies and solutions. With 40 years of experience, they deliver high-quality projects, ensuring that complex challenges are met with tailored approaches, which may include techniques relevant to spot welding."
Welding Solution,Busto Arsizio,,Italy,1-10 Employees,2018,"Welding Solution is a manufacturer that specializes in various welding processes, including MIG/MAG and TIG welding. The company also has expertise in refurbishing valve components, which may be relevant for applications in industries like oil and gas."
Sturm Blechverarbeitung GmbH,Salching,,Germany,251-500 Employees,1993,"The company specializes in sheet metal processing and offers a variety of welding methods, including spot welding, TIG, MIG, and MAG. With 25 years of experience, it ensures precise and reliable production for both small and large quantities, supported by advanced technology and skilled personnel."
