name,city,state,country,employees,founded,description
Kearney,Chicago,,United States,1001-5000 Employees,1926,"Kearney is a global management consulting firm that positions itself as a trusted advisor to leading organizations, focusing on delivering immediate impact and sustainable advantages on critical strategic issues."
Bain & Company,Boston,,United States,10001+ Employees,1973,"Bain & Company is a global consultancy that specializes in management consulting services and collaborates closely with clients to achieve exceptional results and redefine industries. Their expertise spans various sectors, including telecommunications and financial services, and they leverage a vibrant ecosystem of digital innovators to drive sustainable outcomes."
Management Solutions,Madrid,,Spain,1001-5000 Employees,2002,"Management Solutions provides exceptional talent to help clients tackle their business management challenges, emphasizing their expertise in strategy consulting."
OC&C Strategy Consultants,London,,United Kingdom,501-1000 Employees,1987,"OC&C Strategy Consultants is an international consulting firm that specializes in strategy consulting across various sectors, including consumer and technology. With over 30 years of experience, they provide services such as corporate strategy and operational strategy, leveraging analytics to address complex business challenges and deliver impactful results."
Emerton,Paris,,France,51-100 Employees,,"Emerton is a high-end strategy consulting firm that specializes in providing strategic diagnosis, market entry strategies, and commercial due diligence, making it a key player in the strategy consulting landscape. The company has been consistently ranked among the top strategy consulting firms in Europe and the MEA region, highlighting its expertise and innovative approach in advising clients like Eiffel Group and B & Capital."
Matt Investment Agency,Mykolaiv,,Ukraine,1-10 Employees,2016,The company provides strategy consulting as part of its extensive management consultancy services. It focuses on delivering customized information and advice to support businesses in making informed investment decisions in Mykolaiv.
WGA Consulting LLC,Torrance,,United States,1001-5000 Employees,2000,"WGA Consulting LLC specializes in strategy consulting, offering high-impact services that include business planning, performance assessments, and digital transformation, particularly for clients in the pharmaceutical, biotech, and medical product sectors. Their approach emphasizes ethical practices and cost-effectiveness, utilizing advanced technologies and data-driven analysis to develop and implement actionable strategies that enhance operational excellence."
Prophet,San Francisco,,United States,251-500 Employees,1992,"Prophet is focused on unlocking uncommon growth for its clients through its interdisciplinary expertise in strategy consulting, experience, and creative capabilities. Their experience strategy consultants specifically assist in reinventing business models to successfully launch new products and services."
The Boston Consulting Group,Brussels,,Belgium,101-250 Employees,1963,"Boston Consulting Group (BCG) is a leading management consulting firm that specializes in corporate strategy consulting, helping businesses create value and enhance profitability through transformational strategies. With a focus on integrated solutions and deep industry expertise, BCG partners with organizations to address critical challenges and build sustainable competitive advantages."
