name,city,state,country,employees,founded,description
TPL Trakker Ltd.,Karachi Division,,Pakistan,1001-5000 Employees,1999,"TPL Trakker is a leading provider of vehicle tracking solutions, offering robust and secure IoT systems that enable live tracking through a central command center and a mobile app. Their tailored solutions address the pressing needs of clients, ensuring comprehensive security and peace of mind for vehicle owners."
Vehicle Tracking Pvt. Ltd.,Karachi Division,,Pakistan,251-500 Employees,2004,"Vehicle Tracking (Pvt.) Ltd is a leading provider of GPS/GPRS based tracking solutions in Pakistan, having introduced these technologies since 2004. They also offer innovative Iridium satellite based hybrid tracking products and services."
TomTom,Amsterdam,,Netherlands,1001-5000 Employees,1991,"TomTom specializes in geolocation data and mapping solutions, offering robust vehicle and asset tracking applications that enhance operational efficiency and safety. Their technology, including powerful APIs and real-time location data, supports various industries, particularly in fleet management and logistics."
Verizon Connect,Atlanta,,United States,1001-5000 Employees,,"Verizon Connect offers a vehicle tracking app that enhances fleet visibility, allowing users to monitor the status and activity of their vehicles. This solution helps analyze fleet performance over time and promotes safer driving habits through the monitoring of driver behaviors."
Trackstar Stolen Vehicle Tracking,Milton Keynes,,United Kingdom,1001-5000 Employees,2004,"Trackstar, a trading name of Teletrac Navman UK Ltd, offers over 30 years of expertise in vehicle tracking, ensuring the safety and recovery of vehicles across the UK and Europe. Their Thatcham approved system provides 24/7 support for reporting theft, making them a trusted choice for stolen vehicle tracking."
Ruptela,Vilnius,,Lithuania,251-500 Employees,2007,"Ruptela is a leading telematics company that specializes in high-quality GPS tracking devices and advanced fleet management solutions. Their TrustTrack platform offers real-time tracking and resource management, making it an ideal choice for businesses looking to enhance their vehicle tracking capabilities."
Tracking World (Pvt) Ltd,Lahore,,Pakistan,501-1000 Employees,2004,"Tracking World provides customized vehicle tracking solutions that enhance safety and reduce the risk of theft, ensuring expedited asset recovery. With extensive knowledge and partnerships in the industry, they are recognized as one of the world's best tracking and fleet management companies."
Ram Tracking,Leeds,,United Kingdom,11-50 Employees,2004,"Ram Tracking is a leading provider of vehicle tracking and fleet management solutions in the UK, offering advanced GPS tracking software and a comprehensive platform for real-time job assignment and tracking. Their innovative approach and exceptional customer service make them a top choice for businesses needing effective vehicle tracking solutions."
United Track System,-,,-,,,"United Tracker System Pvt Ltd specializes in professional vehicle tracking services in Pakistan, offering a range of affordable GPS car tracking solutions for both private vehicles and cargo. With over 20 years of experience, the company provides various tracking packages and 24/7 support to enhance vehicle security and monitoring."
TrackGPS by AROBS,Cluj-Napoca,,Romania,51-100 Employees,2006,"TrackGPS is a prominent provider of fleet management solutions in Romania, focusing on GPS tracking and vehicle telematics. Their web-based dashboard offers real-time data on vehicle location and condition, making it ideal for effective vehicle tracking and operational efficiency across various sectors."
