name,city,state,country,employees,founded,description
Veolia Energy,Dongcheng District,,China,1001-5000 Employees,,"Veolia specializes in transforming waste into valuable resources, particularly through biomass, which directly aligns with the concept of waste-to-energy. The company's focus on sustainable energy sources and efficient consumption practices supports a low-carbon, circular economy."
Indaver België,Beveren,,Belgium,501-1000 Employees,,"Indaver specializes in creating energy from waste through its advanced incineration processes, offering sustainable and cost-efficient Total Waste Management solutions. With over 30 years of expertise, Indaver focuses on maximizing energy recovery and recycling, positioning itself as a leader in the waste-to-energy sector."
Waste Management,Houston,,United States,10001+ Employees,1968,"The company is involved in waste management, which is closely related to waste-to-energy initiatives."
Waste-to-Energy Association,Washington,,United States,5001-10000 Employees,1985,"The Waste-to-Energy Association (WTEA) represents the majority of modern waste-to-energy facilities in the U.S., which safely dispose of municipal solid waste while generating renewable electricity through advanced combustion technology. WTEA advocates for waste-to-energy as a vital part of sustainable waste management and supports community outreach and education on its benefits."
Covanta,Morristown,,United States,1001-5000 Employees,1983,"Covanta is dedicated to innovative waste management solutions, emphasizing the benefits of Waste-to-Energy disposal. Their commitment to sustainability and advanced technology helps organizations improve their environmental footprint through effective waste recovery and recycling."
East Rockingham Waste to Energy,City of Rockingham,,Australia,251-500 Employees,2019,"Hitachi Zosen Inova (HZI) is a leading player in the waste-to-energy (WTE) sector, providing comprehensive turnkey plants that convert residual waste into energy. Their projects, such as the East Rockingham WTE, not only address climate change but also promote a sustainable waste management system and create local jobs."
DEVISE ENGINEERING S.A.,Athens,,Greece,11-50 Employees,1999,"DEVISE ENGINEERING specializes in the design and manufacture of advanced systems for water, wastewater, and sludge treatment, making it a key player in the environmental market. Their expertise includes offering innovative solutions for Waste-to-Energy projects, emphasizing their commitment to sustainable environmental practices."
Enprode Engineering & Construction,Bahçelievler,,Turkey,51-100 Employees,2005,The company emphasizes its commitment to Waste-to-Energy (WtE) as a key business opportunity that promotes financial benefits and enhanced competitiveness while being environmentally sustainable.
Re Sustainability Limited,Hyderabad,,India,10001+ Employees,1994,"Re Sustainability Limited (RE) provides waste-to-energy solutions, emphasizing their commitment to sustainable environmental practices. With a strong presence in waste management and recycling services, the company plays a crucial role in the circular economy."
Wheelabrator Technologies,Portsmouth,,United States,1001-5000 Employees,1932,WIN Waste Innovations emphasizes its commitment to sustainability through innovative waste and recycling solutions. Their focus on delivering reliable service and advancing the waste management industry aligns with the principles of waste-to-energy initiatives.
