name,city,state,country,employees,founded,description
Jack Mason,Dallas,,United States,11-50 Employees,2015,"Jack Mason offers a selection of premium watch straps, including options in various styles and widths, emphasizing their commitment to quality and design."
CRM Jewelers,Miami,,United States,11-50 Employees,2012,"CRM Jewelers offers a handcrafted Nato watch strap made from genuine calf leather, showcasing their dedication to quality and craftsmanship."
Brighton Collectibles,El Monte,,United States,1001-5000 Employees,,"Brighton offers a stylish Rory Leather Watch Band, featuring a hand-woven design that allows for adjustability and ease of use."
3watches Co. Ltd,Shenzhen,,China,51-100 Employees,2006,"3watches Co., Ltd offers a variety of customizable watch straps, including options made from genuine leather and suede in different colors and styles. Their commitment to quality and customization makes them a strong choice for businesses looking to create unique watch products."
StrapsCo,Town of Champlain,,United States,1-10 Employees,2014,"StrapsCo specializes in premium watch bands, offering a diverse selection including woven nylon straps specifically designed for Apple Watches, compatible with Series 1 to 8. Their products emphasize comfort and durability, with prices starting at $9.99, making them a strong option for watch enthusiasts."
dbramante1928,Ølstykke,,Denmark,501-1000 Employees,2009,"The company specializes in eco-friendly leather goods, including handcrafted Apple Watch straps made from sustainably sourced full-grain leather. Their products are designed to be durable and stylish, developing a beautiful patina over time, and are produced through CO2-neutral processes."
ZULUDIVER,Tewkesbury,,United Kingdom,1-10 Employees,2011,"The company specializes in high-quality replacement watch straps, with a reputation built over a decade. They offer multi-buy discounts and secure delivery options, making their products both accessible and reliable for customers seeking durable watch accessories."
WoodWatch,Rotterdam,,Netherlands,1-10 Employees,2013,"WoodWatch offers a variety of interchangeable watch straps that allow you to express your unique style. Each strap is designed to complement their sustainable wooden watches, making it easy to switch up your look for any occasion."
Nappa Dori,New Delhi,,India,51-100 Employees,2008,"Nappa Dori offers a range of handcrafted genuine leather watch straps, including a distinguished Apple Watch strap designed for a minimalist and functional look. Their straps feature unique detailing and a deployment clasp, making them a stylish addition to any ensemble."
strapSWAP,Munich,,Germany,11-50 Employees,2016,"strapSWAP is a manufacturer of smart wear products, including innovative smart straps that transform traditional watches into smartwatches. These straps feature advanced functionalities like an OLED touchscreen, notifications, and fitness tracking, all while maintaining a stylish design."
