name,city,state,country,employees,founded,description
J. Safra Sarasin,Basel,,Switzerland,1001-5000 Employees,1841,The company specializes in wealth management services.
BNY Mellon Wealth Management,Village of Nyack,,United States,10001+ Employees,1784,"The company, BNY Mellon Wealth Management, emphasizes its role in empowering clients to navigate uncertainties by offering world-class wealth management solutions."
IIFL Wealth Management,Mumbai,,India,1001-5000 Employees,2005,"IIFL Wealth Management Limited emphasizes its commitment to managing wealth for individuals, families, and businesses, highlighting the importance of trust and transparency in their relationships."
Globaleye,Dubai,,United Arab Emirates,251-500 Employees,1991,"The company specializes in bespoke wealth management, emphasizing collaboration to help clients realize their financial goals. They also highlight the importance of succession planning and the art of balancing risk and reward through multi-asset allocation funds."
Wealth Managers,Pasadena,,United States,11-50 Employees,2020,"Wealth Managers is a full-service wealth management corporation that offers a comprehensive range of services, including investment management, real estate, mortgage services, and insurance solutions. The company focuses on integrating these services into clients' financial plans to build long-term partnerships that adapt to their evolving financial needs."
Edelweiss Global Investment Advisors,Mumbai,,India,251-500 Employees,1995,"Nuvama Private is a prominent wealth management firm in India, providing a range of solutions including investment advisory, estate planning, and the distribution of high-quality financial products. With over 20 years of experience, their approach is guided by a core philosophy that emphasizes the creation of ideas and the protection of values."
James Hambro & Partners,London,,United Kingdom,101-250 Employees,,"James Hambro & Partners offers an integrated wealth management service that merges ongoing financial planning with responsive investment management, emphasizing the importance of personal relationships between clients and their financial team."
Wealth Guardians,Sahibzada Ajit Singh Nagar,,India,51-100 Employees,,"Wealth Guardian offers specialized wealth management services, focusing on comprehensive financial and investment solutions designed to meet diverse client needs."
Equirus Wealth,Mumbai,,India,11-50 Employees,2018,"The company emphasizes its commitment to understanding clients' financial goals and risk tolerance, which aligns with their wealth management and financial planning solutions."
Wealth Professional CFP,Bathgate,,United Kingdom,11-50 Employees,2011,"The company, a member of the Benchmark Capital Group, offers comprehensive financial advice and consultancy, emphasizing their philosophy of understanding client needs. Their ""Wealth Platform"" allows clients to access a consolidated view of their wealth anytime, enhancing their wealth management experience."
